URL origen,Fecha de auto,Fecha de publicación,Número de expediente,Resumen,Síntesis completa
https://www.dgej.cjf.gob.mx/siseinternet/reportes/vercaptura.aspx?tipoasunto=10&organismo=473&expediente=170/2024&tipoprocedimiento=0,25-04-2025,28-04-2025,170/2024,"Zapopan, Jalisco, a VEINTICINCO de abril de dos mil veinticinco.
Se tiene por RECIBIDO el OFICIO número * suscrito por el Magistrado Titular de la Primera Ponencia de la Primera Sala Regional de Occidente del Tribunal Federal de Justicia Administrativa, p ...","Zapopan, Jalisco, a VEINTICINCO de abril de dos mil veinticinco.
Se tiene por RECIBIDO el OFICIO número * suscrito por el Magistrado Titular de la Primera Ponencia de la Primera Sala Regional de Occidente del Tribunal Federal de Justicia Administrativa, por el que, en atención al requerimiento realizado en autos, REMITE el expediente administrativo relativo al juicio de nulidad *, en dos tomos. AGRÉGUESE el oficio de cuenta para que surta los efectos legales correspondientes y ACÚSESE RECIBO de lo anterior.   
DEVUÉLVASE este expediente a la PONENCIA respectiva.
Notifíquese. 
Lo acordó y firma el Magistrado Presidente del Tercer Tribunal Colegiado en Materia Administrativa del Tercer Circuito, ante la Secretaria de Acuerdos quien autoriza y da fe."
https://www.dgej.cjf.gob.mx/siseinternet/reportes/vercaptura.aspx?tipoasunto=10&organismo=473&expediente=170/2024&tipoprocedimiento=0,24-06-2025,30-06-2025,170/2024,"ÚNICO. La Justicia de la Unión NO ampara Ni 
protege a * sociedad 
anónima de capital variable, en contra del acto y la 
autoridad precisados en el resultando primero de esta 
sentencia.","ÚNICO. La Justicia de la Unión NO ampara Ni 
protege a * sociedad 
anónima de capital variable, en contra del acto y la 
autoridad precisados en el resultando primero de esta 
sentencia."
https://www.dgej.cjf.gob.mx/siseinternet/reportes/vercaptura.aspx?tipoasunto=10&organismo=473&expediente=170/2024&tipoprocedimiento=0,09-07-2025,10-07-2025,170/2024,"Zapopan, Jalisco, a nueve de julio de dos mil veinticinco.
Se tiene por RECIBIDO el OFICIO número 07-1-1-37573/25 del Magistrado Instructor de la Primera Ponencia de la Primera Sala Regional de Occidente del Tribunal Federal de Justicia Administrativa, me ...","Zapopan, Jalisco, a nueve de julio de dos mil veinticinco.
Se tiene por RECIBIDO el OFICIO número 07-1-1-37573/25 del Magistrado Instructor de la Primera Ponencia de la Primera Sala Regional de Occidente del Tribunal Federal de Justicia Administrativa, mediante el cual ACUSA RECIBO del diverso oficio por el que se remitió testimonio de la sentencia dictada en este asunto y los autos respectivos.
Por tanto, ARCHÍVESE este expediente, y dado que el mismo encuadra en el supuesto del artículo 17, fracción I, inciso a) del Acuerdo General del Pleno del Consejo de la Judicatura Federal, ""que establece las disposiciones en materia de valoración, depuración, destrucción, digitalización, transferencia, resguardo y destino final de los expedientes judiciales generados por los órganos jurisdiccionales"", publicado en el Diario Oficial de la Federación el siete de junio de dos mil veintitrés, porque se NEGÓ el amparo solicitado; en consecuencia, se determina que debe CONSERVARSE en su integridad. 
Notifíquese.
Lo acordó y firma el Magistrado Presidente del Tercer Tribunal Colegiado en Materia Administrativa del Tercer Circuito, ante la Secretaria de Acuerdos, quien autoriza y da fe."
https://www.dgej.cjf.gob.mx/siseinternet/reportes/vercaptura.aspx?tipoasunto=1&organismo=5746&expediente=1425/2025&tipoprocedimiento=0,29-05-2025,30-05-2025,1425/2025,"1. Radicación. Vista la demanda de amparo que promueve ********, contra el acto reclamado del Servicio de Administración Tributaria******************** otra autoridad; fórmese el expediente respectivo******************** anótese su ingreso en el libro ele ...","1. Radicación. Vista la demanda de amparo que promueve ********, contra el acto reclamado del Servicio de Administración Tributaria******************** otra autoridad; fórmese el expediente respectivo******************** anótese su ingreso en el libro electrónico de gobierno de este juzgado, bajo el progresivo 1425/2025-V.
2. Admisión de la demanda. Con fundamento en los artículos 1, 103, fracción I, 107, fracciones I******************** VII, de la Constitución Federal; 1, fracción I, 35, 37, 107, 108, 112, 115******************** 117, de la Ley de Amparo, se admite a trámite la demanda de mérito.
3. Incidente de suspensión. Tramítese por separado el incidente de suspensión, sin que sea necesaria la formación de un duplicado físico, en términos del artículo 264 del Acuerdo General del Pleno del Consejo de la Judicatura Federal que establece las disposiciones en materia de actividad administrativa de los órganos jurisdiccionales.
4. Pruebas. Con fundamento en lo establecido en el segundo párrafo del artículo 119 de la ley de la materia, se tienen por ofrecidas, admitidas******************** desahogadas, en razón de su propia******************** especial naturaleza, las pruebas documentales que allegó el quejoso, la instrumental de actuaciones******************** la presuncional, mismas que serán tomadas en consideración al momento de resolver el presente asunto.
5. Requerimiento de informe justificado. Pídanse informes justificados a las autoridades responsables, quienes deberán rendirlo dentro del plazo de quince días siguientes al en que reciban el oficio en el que se les solicita.
6. Audiencia constitucional. Se señalan las DOCE HORAS CON DIEZ MINUTOS DEL DIECIOCHO DE JUNIO DE DOS MIL VEINTICINCO, para que tenga verificativo la audiencia constitucional, atendiendo a la saturación en la agenda de este juzgado.
7. Tercero interesado. Con fundamento en el numeral 5°, fracción III de la Ley reglamentaria de los artículos 103******************** 107 Constitucionales,******************** dada la naturaleza del acto reclamado, no existen terceros interesados. 
8. Vista al Agente del Ministerio Público de la Federación adscrito. Dese al Agente del Ministerio Público de la Federación adscrito, la intervención que legalmente le corresponde, en términos del artículo 5, fracción IV, del ordenamiento legal en cita. 
9. Requerimiento a las partes en caso de actualizarse alguna causal de improcedencia. Con fundamento en el artículo 64 de la Ley de Amparo, solicítese a las partes que, en caso de tener conocimiento de que en el caso se actualiza alguna causa de sobreseimiento, lo comuniquen de inmediato a este Juzgado de Distrito, de ser posible, acompañando las constancias que la acrediten."
https://www.dgej.cjf.gob.mx/siseinternet/reportes/vercaptura.aspx?tipoasunto=1&organismo=5746&expediente=1425/2025&tipoprocedimiento=0,29-05-2025,30-05-2025,1425/2025,"1. Formación de incidente de suspensión. Como está ordenado en esta fecha en el cuaderno principal, con copia simple de la demanda de amparo, se da trámite por al incidente de suspensión relativo al juicio de amparo indirecto 1425/2025-V que promueve **** ...","1. Formación de incidente de suspensión. Como está ordenado en esta fecha en el cuaderno principal, con copia simple de la demanda de amparo, se da trámite por al incidente de suspensión relativo al juicio de amparo indirecto 1425/2025-V que promueve ****** contra el acto reclamado de Servicio de Administración Tributaria******************** otra autoridad. 
2. Requerimiento de informe previo. Con apoyo en lo dispuesto en los artículos 128, 136, 138******************** 140, de la Ley de Amparo, pídase a la autoridad responsable su informe previo que deberá rendir dentro del término de cuarenta******************** ocho horas, enviándole al efecto copia simple de la demanda de amparo. 
3. Audiencia incidental. De conformidad con lo dispuesto en el artículo 138, fracción II, de la Ley de Amparo, se señalan las ONCE HORAS CON TREINTA Y NUEVE MINUTOS DEL CINCO DE JUNIO DE DOS MIL VEINTICINCO, para que tenga verificativo la audiencia incidental. 
4. Pruebas. Con fundamento en lo establecido en el segundo párrafo del artículo 143 de la ley de la materia, se tienen por ofrecidas, admitidas******************** desahogadas, en razón de su propia******************** especial naturaleza, las pruebas documentales que allegó el quejoso, exhibidas con el escrito de demanda******************** que previo cotejo******************** compulsa se agregan a los autos, las cuales serán tomadas en consideración al momento de resolver el presente asunto.
4.1 Estudio relativo a la suspensión provisional.
La parte quejosa reclama de las autoridades responsables la siguiente omisión: 
""Dar respuesta, debidamente fundada******************** motivada, a la solicitud o caso de aclaración presentado por la quejosa en términos del segundo párrafo del artículo 17-H Bis del CFF, incluso la omisión de no restablecer el uso del CSD al día siguiente de la presentación de dicha solicitud.""
Se concede la suspensión provisional de los actos reclamados, toda vez que se encuentran satisfechos los requisitos previstos antes indicados, para el efecto que la autoridad responsable restablezca el uso del certificado de sello digital para la expedición de Comprobantes Fiscales Digitales por Internet."
https://www.dgej.cjf.gob.mx/siseinternet/reportes/vercaptura.aspx?tipoasunto=1&organismo=5746&expediente=1425/2025&tipoprocedimiento=0,02-06-2025,03-06-2025,1425/2025,"Vista la cuenta que antecede, se tiene por recibido el escrito que firma de manera electrónica Juan Carlos de Obeso Orendain, en su carácter de autorizado en amplios términos de la parte quejosa en el presente juicio, y atento a lo que solicita, dígasele  ...","Vista la cuenta que antecede, se tiene por recibido el escrito que firma de manera electrónica Juan Carlos de Obeso Orendain, en su carácter de autorizado en amplios términos de la parte quejosa en el presente juicio, y atento a lo que solicita, dígasele que ya se encuentran autorizados los usuarios ******, para la práctica de notificaciones y la consulta del expediente electrónico********."
https://www.dgej.cjf.gob.mx/siseinternet/reportes/vercaptura.aspx?tipoasunto=1&organismo=5746&expediente=1425/2025&tipoprocedimiento=0,04-06-2025,05-06-2025,1425/2025,"Téngase por recibido el escrito firmado electrónicamente por el autorizado en términos amplios de la persona moral quejosa, y atento a su contenido, en esencia, se encuentra solicitando el cumplimiento de la medida suspensional provisional decretada en au ...","Téngase por recibido el escrito firmado electrónicamente por el autorizado en términos amplios de la persona moral quejosa, y atento a su contenido, en esencia, se encuentra solicitando el cumplimiento de la medida suspensional provisional decretada en auto de veintinueve de mayo del año en curso, al respecto, dígasele que tal como se advierte de la certificación realizada en el presente proveído, aún no se cuenta con acuse de recibo de los oficios mediante los cuales se ordenó notificar a las autoridades señaladas como responsables Servicio de Administración Tributaria y Administración Central de Fiscalización Estratégica de la Administración General de Auditoría Fiscal Federal del Servicio de Administración Tributaria, por lo tanto, esta Juzgadora no cuenta con certeza de que dichas responsables tengan de conocimiento del auto dictado el veintinueve de mayo de dos mil veinticinco.
En tales condiciones,  una vez que se tenga constancia de que dichas autoridades responsables ya se encuentran notificadas, se proveerá lo conducente."
https://www.dgej.cjf.gob.mx/siseinternet/reportes/vercaptura.aspx?tipoasunto=1&organismo=5746&expediente=1425/2025&tipoprocedimiento=0,05-06-2025,06-06-2025,1425/2025,"Por tanto, para dar oportunidad a que dichos oficios y sus anexos sean notificados a las autoridades responsables, asimismo, remitan su informe previo, se difiere la audiencia prevista para hoy, y en su lugar se programan las TRECE HORAS CON CUARENTA Y NU ...","Por tanto, para dar oportunidad a que dichos oficios y sus anexos sean notificados a las autoridades responsables, asimismo, remitan su informe previo, se difiere la audiencia prevista para hoy, y en su lugar se programan las TRECE HORAS CON CUARENTA Y NUEVE MINUTOS DEL DOCE DE JUNIO DE DOS MIL VEINTICINCO para que el verificativo."
https://www.dgej.cjf.gob.mx/siseinternet/reportes/vercaptura.aspx?tipoasunto=1&organismo=5746&expediente=1425/2025&tipoprocedimiento=0,10-06-2025,11-06-2025,1425/2025,"En tales condiciones, previo a hacer efectivos los medios de apremio correspondientes, con fundamento en el artículo 297, fracción II, del Código Federal de Procedimientos Civiles, de aplicación supletoria a la Ley de Amparo, por remisión expresa de su nu ...","En tales condiciones, previo a hacer efectivos los medios de apremio correspondientes, con fundamento en el artículo 297, fracción II, del Código Federal de Procedimientos Civiles, de aplicación supletoria a la Ley de Amparo, por remisión expresa de su numeral 2°, requiérase las autoridades responsables Servicio de Administración Tributaria y Administración Central de Fiscalización Estratégica de la Administración General de Auditoría Fiscal Federal del Servicio de Administración Tributaria, para que, en el término de veinticuatro horas, contadas a partir del momento siguiente al en que reciban la comunicación respectiva, informen el cumplimiento dado a la suspensión provisional dictada el veintinueve de mayo de la presente anualidad, o en su caso, informen el impedimento legal con que cuenten para cumplir con dicha suspensión, debiendo remitir las constancias con las que así lo acrediten."
https://www.dgej.cjf.gob.mx/siseinternet/reportes/vercaptura.aspx?tipoasunto=1&organismo=5746&expediente=1425/2025&tipoprocedimiento=0,12-06-2025,13-06-2025,1425/2025,"AUDIENCIA INCIDENTAL
Por lo expuesto y fundado en la presente interlocutoria, se 
R E S U E L V E:
ÚNICO. Se concede a ********************, la suspensión definitiva solicitada contra el acto  reclamado a las autoridades responsables Servicio de Administr ...","AUDIENCIA INCIDENTAL
Por lo expuesto y fundado en la presente interlocutoria, se 
R E S U E L V E:
ÚNICO. Se concede a ********************, la suspensión definitiva solicitada contra el acto  reclamado a las autoridades responsables Servicio de Administración Tributaria y la Administración Central de Fiscalización Estratégica, del Servicio de Administración Tributaria, por los motivos señalados en el considerando tercero de la resolución que antecede."
https://www.dgej.cjf.gob.mx/siseinternet/reportes/vercaptura.aspx?tipoasunto=1&organismo=5746&expediente=1425/2025&tipoprocedimiento=0,18-06-2025,19-06-2025,1425/2025,"Vista la certificación del presente proveído, se advierte que el plazo para que las autoridades responsables Servicio de Administración Tributaria y Administración Central de Fiscalización Estratégica de la Administración General de Auditoria Fiscal Feder ...","Vista la certificación del presente proveído, se advierte que el plazo para que las autoridades responsables Servicio de Administración Tributaria y Administración Central de Fiscalización Estratégica de la Administración General de Auditoria Fiscal Federal del Servicio de Administración Tributaria, para que rindan su informe justificado, se encuentra transcurriendo, por tanto, para dar oportunidad a que dichas autoridades alleguen su informe de ley, se difiere la audiencia prevista para hoy, y se señalan las DOCE HORAS CON VEINTICINCO MINUTOS DEL SIETE DE JULIO DE DOS MIL VEINTICINCO para su verificativo."
https://www.dgej.cjf.gob.mx/siseinternet/reportes/vercaptura.aspx?tipoasunto=1&organismo=5746&expediente=1425/2025&tipoprocedimiento=0,07-07-2025,08-07-2025,1425/2025,"Vista la cuenta que antecede, téngase por recibido el oficio firmado de manera electrónica por el Subadministrador adscrito a la Administración de Amparo e Instancias Judiciales ""1"" de la Administración Central de Amparo e Instancias Judiciales, de la Adm ...","Vista la cuenta que antecede, téngase por recibido el oficio firmado de manera electrónica por el Subadministrador adscrito a la Administración de Amparo e Instancias Judiciales ""1"" de la Administración Central de Amparo e Instancias Judiciales, de la Administración General Jurídica del Servicio de Administración Tributaria, en representación de la autoridades responsables Administración Central de Fiscalización Estratégica y Jefe del Servicio de Administración Tributaria, mediante el cual, rinde su informe justificado; con lo anterior, de conformidad con el artículo 117 de la Ley de Amparo, dese vista a las partes para que manifiesten lo que a su interés convenga, sin perjuicio de volver a relacionarlo al celebrarse la audiencia constitucional.
En virtud de lo anterior, se difiere la audiencia constitucional programada para hoy y en su lugar se fijan las ONCE HORAS CON CINCUENTA Y CINCO MINUTOS DEL ONCE DE AGOSTO DE DOS MIL VEINTICINCO.
Notifíquese personalmente.
Así lo proveyó y firma la maestra María Gabriela Ruiz Márquez, Jueza Sexto de Distrito en Materia Administrativa en el Estado de Jalisco, ante Ricardo Alberto Marín Metlich, Secretario que autoriza y da fe."
https://www.dgej.cjf.gob.mx/siseinternet/reportes/vercaptura.aspx?tipoasunto=1&organismo=5746&expediente=1425/2025&tipoprocedimiento=0,11-08-2025,12-08-2025,1425/2025,"Vista la certificación de cuenta, se desprende que aún no transcurre el plazo de quince días otorgado a la parte quejosa para que manifieste si desea ampliar su demanda de amparo.
En consecuencia, para dar oportunidad a lo anterior, se difiere la audienci ...","Vista la certificación de cuenta, se desprende que aún no transcurre el plazo de quince días otorgado a la parte quejosa para que manifieste si desea ampliar su demanda de amparo.
En consecuencia, para dar oportunidad a lo anterior, se difiere la audiencia constitucional programada para hoy y en su lugar se fijan las DIEZ HORAS CON VEINTICINCO MINUTOS DEL DIEZ DE SEPTIEMBRE DE DOS MIL VEINTICINCO."
https://www.dgej.cjf.gob.mx/siseinternet/reportes/vercaptura.aspx?tipoasunto=1&organismo=5746&expediente=1425/2025&tipoprocedimiento=0,04-09-2025,05-09-2025,1425/2025,"Vista la cuenta que antecede, téngase por recibido el oficio signado por la autoridad responsable Servicio de Administración Tributaria y de la Administración Central de Fiscalización Estratégica, por medio de la cual hace manifestaciones a manera de aleg ...","Vista la cuenta que antecede, téngase por recibido el oficio signado por la autoridad responsable Servicio de Administración Tributaria y de la Administración Central de Fiscalización Estratégica, por medio de la cual hace manifestaciones a manera de alegatos, mismos que se ser procedentes serán tomados en consideración en el momento procesal oportuno. 
Ahora, con fundamento en lo establecido en el segundo párrafo del artículo 119 de la ley de la materia, se tienen por ofrecidas, admitidas y desahogadas, en razón de su propia y especial naturaleza, las pruebas documentales que allegó, mismas que serán tomadas en consideración al momento de resolver el presente asunto. 
Ahora, con respecto a la designación de delegados que refiere, dígasele que ya se proveyó lo conducente en auto de siete de julio de la presente anualidad."
https://www.dgej.cjf.gob.mx/siseinternet/reportes/vercaptura.aspx?tipoasunto=1&organismo=5746&expediente=1425/2025&tipoprocedimiento=0,04-09-2025,05-09-2025,1425/2025,"Autoridad responsable Servicio de Administración Tributaria y de la Administración Central de Fiscalización Estratégica, informa el tratamiento dado en el sentido de señalar las gestiones empleadas para el cumplimiento de la medida cautelar, dese vista a  ...","Autoridad responsable Servicio de Administración Tributaria y de la Administración Central de Fiscalización Estratégica, informa el tratamiento dado en el sentido de señalar las gestiones empleadas para el cumplimiento de la medida cautelar, dese vista a la parte quejosa para que manifieste lo que su legal derecho convenga.
Ahora, por lo que refiere al segundo de sus oficios, interponen recurso de revisión en contra la interlocutoria dictada el doce de junio de dos mil veinticinco; en tal virtud, con fundamento en los artículos 81, 84, 86, 88 y 89 de la Ley de Amparo, se ordena dar trámite al recurso planteado.
De acuerdo con lo previsto por el numeral 89 de la Ley de Amparo, se ordena distribuir el escrito de expresión de agravios entre las partes distintas a las recurrentes.
Una vez que este expediente se encuentre debidamente integrado, con las constancias de notificación de la interlocutoria y del presente proveído, remítase al Tribunal Colegiado en Materia Administrativa del Tercer Circuito, en turno.
Notifíquese; y personalmente a la quejosa."
https://www.dgej.cjf.gob.mx/siseinternet/reportes/vercaptura.aspx?tipoasunto=1&organismo=5746&expediente=1425/2025&tipoprocedimiento=0,10-09-2025,11-09-2025,1425/2025,"Visto el estado que guardan los autos, de los que se advierte que el día de hoy se encuentran señaladas las diez horas con veinticinco minutos del día de hoy, para la celebración de la audiencia constitucional del presente expediente; sin embargo, debido  ...","Visto el estado que guardan los autos, de los que se advierte que el día de hoy se encuentran señaladas las diez horas con veinticinco minutos del día de hoy, para la celebración de la audiencia constitucional del presente expediente; sin embargo, debido a la conclusión de funciones de la titular que fungía en este Juzgado de Distrito, por mandato constitucional, se designó a la licenciada Leticia Cuadra González, como Secretaria Encargada del Despacho por Ministerio de Ley, con fundamento en el artículo 41, párrafo segundo, de la Ley Orgánica del Poder Judicial de la Federación, únicamente se encuentra facultada para la práctica de las diligencias y providencias de mero trámite, así como de resoluciones de carácter urgente; en consecuencia, la audiencia constitucional señalada para el día de hoy se difiere y para su verificativo se fijan las ONCE HORAS CON QUINCE MINUTOS DEL SEIS DE OCTUBRE DE DOS MIL VEINTICINCO."
https://www.dgej.cjf.gob.mx/siseinternet/reportes/vercaptura.aspx?tipoasunto=1&organismo=5746&expediente=1425/2025&tipoprocedimiento=0,06-10-2025,07-10-2025,1425/2025,"Visto el estado de autos, se hace del conocimiento de las partes que a partir del dieciséis de septiembre del año en curso, quien suscribe Jueza Madián Sinaí Menchaca Sierra, funjo como Titular del Juzgado Sexto de Distrito en Materia Administrativa en el ...","Visto el estado de autos, se hace del conocimiento de las partes que a partir del dieciséis de septiembre del año en curso, quien suscribe Jueza Madián Sinaí Menchaca Sierra, funjo como Titular del Juzgado Sexto de Distrito en Materia Administrativa en el Estado de Jalisco, con residencia en Zapopan, de conformidad con lo estipulado en el Acuerdo General del Pleno del Órgano de Administración Judicial AG-POAJ-008/2025, de fecha doce de septiembre de dos mil veinticinco, emitido por el Secretario Ejecutivo del Pleno del Órgano de Administración Judicial.
Ahora bien, con la finalidad de que las partes se encuentren debidamente notificadas del presente acuerdo, lo que posibilita a las partes poder imponerse del presente juicio de amparo, se fijan las ONCE HORAS CON TREINTA MINUTOS DEL SEIS DE NOVIEMBRE DE DOS MIL VEINTICINCO, para que tenga verificativo la celebración de la audiencia constitucional."
https://www.dgej.cjf.gob.mx/siseinternet/reportes/vercaptura.aspx?tipoasunto=1&organismo=5746&expediente=1425/2025&tipoprocedimiento=0,08-10-2025,09-10-2025,1425/2025,"Visto el estado de autos, se advierte que el recurso de revisión interpuesto en contra de la interlocutoria de doce de junio de dos mil veinticinco, se encuentra integrado.
En consecuencia, se ordena enviar oficio a la Oficina de Correspondencia Común de  ...","Visto el estado de autos, se advierte que el recurso de revisión interpuesto en contra de la interlocutoria de doce de junio de dos mil veinticinco, se encuentra integrado.
En consecuencia, se ordena enviar oficio a la Oficina de Correspondencia Común de los Tribunales Colegiados en Materia Administrativa del Tercer Circuito, a efecto de que turne el aludido recurso, acompañándole el escrito original de agravios.
En otro orden de ideas, se hace del conocimiento de las partes que a partir del dieciséis de septiembre de dos mil veinticinco, quien suscribe Jueza Madián Sinaí Menchaca Sierra, funjo como Titular del Juzgado Sexto de Distrito en Materia Administrativa en el Estado de Jalisco, con residencia en Zapopan, de conformidad con lo estipulado en el Acuerdo General AG-POAJ-008/2025, de fecha doce de septiembre de dos mil veinticinco, emitido por el Pleno del Órgano de Administración Judicial, lo anterior para los efectos legales consiguientes."
https://www.dgej.cjf.gob.mx/siseinternet/reportes/vercaptura.aspx?tipoasunto=1&organismo=5746&expediente=1425/2025&tipoprocedimiento=0,16-10-2025,17-10-2025,1425/2025,"Cuarto Tribunal Colegiado en Materia Administrativa del Tercer Circuito, informa que dicho órgano jurisdiccional admitió el recurso de revisión interpuesto por la autoridad responsable.","Cuarto Tribunal Colegiado en Materia Administrativa del Tercer Circuito, informa que dicho órgano jurisdiccional admitió el recurso de revisión interpuesto por la autoridad responsable."
