URL origen,Fecha de auto,Fecha de publicación,Número de expediente,Resumen,Síntesis completa
https://www.dgej.cjf.gob.mx/siseinternet/reportes/vercaptura.aspx?tipoasunto=11&organismo=129&expediente=34/2025&tipoprocedimiento=0,06-03-2025,07-03-2025,34/2025,"Vista la cuenta que antecede, se tiene por recibido el oficio del Secretario de Acuerdos del Tercer Tribunal Colegiado en Materia Administrativa del Tercer Circuito, a través del cual remite, entre otras constancias, los autos del recurso de revisión inci ...","Vista la cuenta que antecede, se tiene por recibido el oficio del Secretario de Acuerdos del Tercer Tribunal Colegiado en Materia Administrativa del Tercer Circuito, a través del cual remite, entre otras constancias, los autos del recurso de revisión incidental ********************, formado con motivo del escrito de agravios interpuesto por ********************, delegada del ********************, cuya sede se encuentra en la ********************, carácter que tiene reconocido en auto de once de abril de dos mil veinticinco, emitido en el juicio de amparo indirecto ********************, del otrora Juzgado Decimosexto de Distrito en Materias Administrativa, Civil y de Trabajo en el Estado de ********************, actualmente tramitado bajo el número ********************, del Juzgado Cuarto de Distrito en Materia de Trabajo del Estado de ********************; contra la sentencia interlocutoria dictada el veintiséis de marzo de dos mil veinticuatro, en el incidente de suspensión derivado del juicio de amparo indirecto de origen, en la que se determinó conceder a la quejosa ********************, la suspensión solicitada, además, acompaña los autos del referido incidente de suspensión; fórmese el expediente respetivo y regístrese como recurso de revisión incidental 34/2025.
Acúsese recibo.
Aunado a lo anterior, el Tribunal Administrativo remitente acompaña impresión de la sentencia dictada en sesión de quince de enero del año en curso, a través de la cual se declaró legalmente incompetente para conocer del recurso de revisión incidental ********************, al considerar:
""(.) 
Así las cosas, la parte quejosa reclama el Decreto por el que se reforman, adicionan y derogan diversas disposiciones de la Ley Federal del Trabajo, en particular, los artículos 279, Quáter, 280, 283, fracciones II, VI, VII, X, XI, segundo párrafo, XIII, XIV, XIX, 997-A, fracciones I y II, y 284 Bis, fracción IV, en relación con los artículos, 15, 237-A y 237-D de la Ley del Seguro Social, en materia de derechos laborales de las personas trabajadoras del campo, publicado en el Diario Oficial de la Federación el veinticuatro de enero de dos mil veinticuatro, y que, según su dicho, es sistema normativo reclamado quebranta los principios constitucionales determinados en los numerales 1°, 3°, 4°, 5°, 14, 16, 27, 31, fracción IV, 123 y demás relativos de la Constitución Política de los Estados Unidos Mexicanos, en relación con los artículos 1°, 6°, 7°, 9°, 10 y 13 del Pacto de San Salvador.
Preceptos normativos que prevén, sustancialmente, obligaciones por parte de las personas empleadoras del campo, respecto de sus trabajadores..
En ese contexto, se aprecia que la moral quejosa se ostentó como empleadora y, con esa calidad, reclama la inconstitucionalidad de disposiciones tanto de la Ley Federal del Trabajo, como de la Ley del Seguro Social; por tanto, atendiendo al bien jurídico o interés fundamental controvertido, este Tribunal Colegiado estima que tales actos son de naturaleza netamente laboral, porque se refieren al establecimiento de nuevas condiciones de trabajo, puesto que están dirigidos esencialmente a la regulación de un sistema en materia de derechos laborales y de seguridad social de las personas trabajadoras del campo, incorporado en el multicitado Decreto reclamado, que atañe a derechos de seguridad social, salud y educación.
(.)""

Por otra parte, del escrito de demanda se advierte que la quejosa, en lo que interesa, tal como aduce el órgano de control constitucional antes señalado, aduce ser una sociedad que tiene como objeto social, el cultivo, siembra, cosecha, producción, explotación, recolección, empaque, compraventa, exportación e importación de todo tipo de hortalizas, hierbas, legumbres, verduras, frutas, cereales y en general todos los productos del campo, así como que, para explotar su objeto social durante el mes de enero de dos mil veinticuatro, empleó a diversas personas trabajadoras del campo, con las cuales celebró contratos de carácter eventual o estacionales, los cuales seguían vigentes a la fecha de presentación de la demanda de amparo. 
En razón de ello, hace valer como acto reclamado el Decreto por el que se reforman, adicionan y derogan diversas disposiciones de la Ley Federal del Trabajo, en particular, los artículos 279, Quáter, 280, 283, fracciones II, VI, VII, X, XI, segundo párrafo, XIII, XIV, XIX, 997-A, fracciones I y II, y 284 Bis, fracción IV, en relación con los artículos, 15, 237-A y 237-D de la Ley del Seguro Social, en materia de derechos laborales de las personas trabajadoras del campo, publicado en el Diario Oficial de la Federación el veinticuatro de enero de dos mil veinticuatro.
Por lo antes expuesto y, con fundamento en lo dispuesto por los artículos 47, 48 y 170 fracción I, de la Ley de Amparo, y 35, fracción I, inciso d), de la Ley Orgánica del Poder Judicial de la Federación, este Tribunal acepta la competencia declinada y se avoca al conocimiento del recurso de revisión incidental, ello, en virtud de que se está ante actos de naturaleza laboral, pues el Decreto que la parte quejosa combate en el juicio de ogien, establece nuevas condiciones de trabajo, al estar dirigidos esencialmente a la regulación de un sistema en materia de derechos laborales y de seguridad social de las personas trabajadoras del campo.
Es por lo que, ante el avocamiento al conocimiento del recurso de revisión, este Segundo Tribunal Colegiado en Materia de Trabajo del Tercer Circuito, hace suyas las actuaciones que integran el recurso de revisión incidental ******************** (esto es, se tiene por admitido el mismo).
Sin que para ello sea óbice que con fecha veintinueve de mayo de dos mil veinticuatro, se efectuara el dictado de la sentencia definitiva, en la que se resuelve sobreseer en el juicio de amparo; ello  atiende a que, en proveído de diecisiete de junio de ese mismo año, se tuvo a la parte quejosa interponiendo recurso de revisión contra la citada resolución, sin que de las diversas actuaciones se desprenda la resolución del referido medio de impugnación.
Hágase saber el contenido de este proveído a la parte quejosa y al Agente del Ministerio Público de la Federación adscrito, de conformidad con lo establecido por el artículo 5, fracción IV, de la Ley de Amparo.
Sin desatender que, en proveído admisorio de veintisiete de junio de dos mil veinticuatro, el Tribunal Administrativo remitente, se pronunció respecto a lo establecido por el artículo 82 de la Ley de Amparo, razón por la cual resulta innecesario hacer del  conocimiento del quejoso, el término de cinco días para adherirse a este recurso, en razón de que el mismo, transcurrió a la fecha en la procesalmente fue turnado el recurso de revisión incidental ********************; lo que se hace constar para los efectos legales consiguientes.
No ha lugar a admitir la prueba documental consistente en el oficio y guía descritos en el escrito de agravios, en razón de que el artículo 75 de la Ley de Amparo, el cual se aplica por analogía, establece que el acto reclamado se apreciará tal y como fue probado ante la autoridad responsable, en este caso, el Juzgado Federal.
A fin de notificar el presente proveído a la parte quejosa, por única ocasión, notifíquese personalmente el presente acuerdo en la finca ubicada en la calle ********************, número ********************, fraccionamiento ********************, en el municipio de ********************, ********************, domicilio que se desprende del escrito de demanda de amparo, que integra el juicio de amparo del que emana el incidente de suspensión respectivo.
En el entendido que, de no señalar domicilio procesal para la continuación del trámite de este recurso, de conformidad a lo establecido por el artículo 27, fracción III, inciso a), de la Ley de Amparo y el diverso numeral 29, del citado ordenamiento legal, las subsecuentes notificaciones personales que surjan del trámite correspondiente, se realizarán a la parte recurrente mediante lista que se publicará en el Sistema Integran de Seguimiento de Expedientes, medida procesal que tendrá verificativo hasta en tanto formule el señalamiento respectivo o se solicite su práctica de manera electrónica.
Se habilitan días y horas inhábiles, para la práctica de las notificaciones y diligencias relacionadas con el trámite de este procedimiento, con fundamento en lo dispuesto por el artículo 21 de la Ley de Amparo.
Se tiene como delegados de la parte recurrente en términos del artículo 9 de la Ley de Amparo, a las personas que se mencionan.
En atención a lo dispuesto por el precepto 305 del Código Federal de Procedimientos Civiles de aplicación supletoria a la Ley de Amparo, en términos del numeral 2°, párrafo segundo, de este ordenamiento se tiene como domicilio procesal el indicado; sin desatender que, no obstante que éste se encuentra fuera de la jurisdicción de este Tribunal, esto es, en la ********************, dado que la parte recurrente, actúa en su carácter de autoridad responsable, las notificaciones que surjan del trámite de este expediente, incluso las carácter personal, se efectuarán de conformidad a lo establecido en el artículo 28, fracción II, de la ley de la materia, por lo que, el oficio que para tal efecto se expida, será enviado al domicilio proporcionado.
En razón de lo establecido en la Circular 12/2009, del Secretario Ejecutivo del Pleno del Consejo de la Judicatura Federal, se autoriza para imponerse de los autos el uso de aparatos electrónicos como cámaras, grabadores o lectores ópticos.
En otro sentido, de conformidad con lo establecido en los artículos 252, 253, 261, 262 y 263, del Acuerdo General del Pleno del Consejo de la Judicatura Federal, que abroga los diversos Acuerdos de contingencia por Covid-19 y reforma, adiciona y deroga diversas disposiciones relativas a la utilización de medios electrónicos y soluciones digitales como ejes rectores del nuevo esquema de trabajo en las áreas administrativas y órganos jurisdiccionales, del propio consejo, el cual entró en vigor a partir del siete de noviembre de dos mil veintidós, se exhorta a las partes para que, en su caso, transiten a la modalidad de expediente electrónico y juicio de amparo en línea, a través de los módulos tecnológicos y soluciones digitales creados por el Consejo de la Judicatura Federal.
De igual forma, se hace de su conocimiento que, conforme al precepto tercero transitorio del aludido Acuerdo General, a partir del siete de noviembre de dos mil veintidós, se reanudaron labores de forma regular en los órganos jurisdiccionales; así como que, del esquema establecido en los Acuerdos Generales emitidos con motivo de la contingencia sanitaria ocasionada por el virus Covid-19, subsiste la integración y trámite de expediente electrónico y el uso de videoconferencias en todos los asuntos competencia de los órganos jurisdiccionales.
Por ende, conforme al citado Acuerdo General del Pleno del Consejo de la Judicatura Federal, específicamente en lo dispuesto por los artículos 253 y 263, en lo subsecuente, en el expediente físico, únicamente serán agregadas las promociones que se presenten de manera física y las constancias de notificación que resulten en este trámite; mientras que, los acuerdos correspondientes obrarán sólo en el expediente electrónico.
Con fundamento en lo dispuesto por los artículos 1, 2 fracciones I y II, 9, 10, 68, 77, 97, 98, 99, 113, 118, 119, 120 y 144 del Decreto por el que se abroga la Ley Federal de Transparencia y Acceso a la Información Pública Gubernamental y se expide la Ley Federal de Transparencia y Acceso a la Información Pública, de los artículos 2º, fracciones IV, XXII y XXIII, del Reglamento Interior de la Suprema Corte de Justicia de la Nación, toda información generada, obtenida, adquirida, transformada o en posesión, es pública, accesible a cualquier persona y sólo puede ser clasificada excepcionalmente como reservada de forma temporal por razones de interés público, seguridad nacional, o bien, confidencial; se considera confidencial la que contiene datos personales concernientes a una persona física identificada o identificable; para que los sujetos obligados puedan permitir el acceso a información confidencial requieren obtener el consentimiento de los particulares titulares de la información. Las solicitudes de acceso a la información y las respuestas que se les dé, incluyendo, en su caso, la información entregada, serán públicas. Asimismo, las Áreas correspondientes deberán poner a disposición del público esta información, en la medida de lo posible a través de medios remotos o locales de comunicación electrónica.
NOTIFÍQUESE POR LISTA ELECTRÓNICA, PERSONALMENTE A LA QUEJOSA Y MEDIANTE OFICIO A LA AUTORIDAD, AQUÍ RECURRENTE, ASÍ COMO A LAS DIVERSAS RESPONSABLES."
https://www.dgej.cjf.gob.mx/siseinternet/reportes/vercaptura.aspx?tipoasunto=11&organismo=129&expediente=34/2025&tipoprocedimiento=0,11-03-2025,12-03-2025,34/2025,"De conformidad con lo dispuesto por el artículo 24, fracción II, de la Ley Orgánica del Poder Judicial de la Federación, se turna este asunto a la ponencia a cargo del Magistrado Héctor Pérez Pérez, para el proyecto de sentencia.
NOTIFÍQUESE POR LISTA ELE ...","De conformidad con lo dispuesto por el artículo 24, fracción II, de la Ley Orgánica del Poder Judicial de la Federación, se turna este asunto a la ponencia a cargo del Magistrado Héctor Pérez Pérez, para el proyecto de sentencia.
NOTIFÍQUESE POR LISTA ELECTRÓNICA."
https://www.dgej.cjf.gob.mx/siseinternet/reportes/vercaptura.aspx?tipoasunto=11&organismo=129&expediente=34/2025&tipoprocedimiento=0,26-09-2025,29-09-2025,34/2025,"Con fundamento en lo dispuesto por el artículo 88 del Código Federal de Procedimientos Civiles de aplicación supletoria a la Ley de Amparo, en términos del precepto 2°, párrafo segundo, de este ordenamiento, como hecho notorio, se colige que por oficio ** ...","Con fundamento en lo dispuesto por el artículo 88 del Código Federal de Procedimientos Civiles de aplicación supletoria a la Ley de Amparo, en términos del precepto 2°, párrafo segundo, de este ordenamiento, como hecho notorio, se colige que por oficio ********************, el Secretario Técnico de la Comisión de Adscripción, Encargado del Despacho de la Secretaría Ejecutiva de Adscripción, del entonces Consejo de la Judicatura Federal, informó que en sesión ordinaria celebrada el trece de agosto de dos mil veinticinco, el Pleno del Consejo aludido, acordó la readscripción del Magistrado Luis Ávalos García, en sustitución de la Magistrada Cecilia Peña Covarrubias, con efectos a partir del día siguiente de la renuncia de la nombrada Magistrada (veintiséis de agosto del año en curso), con efectos a partir del catorce del citado mes y año y surtiendo efectos hasta el quince de septiembre del presente año.
Asimismo, en cumplimiento al ACUERDO GENERAL DEL PLENO DEL ÓRGANO DE ADMINISTRACIÓN JUDICIAL POR EL QUE SE ADSCRIBEN A LAS PERSONAS ELECTAS EN EL PROCESO ELECTORAL EXTRAORDINARIO A DIVERSOS CARGOS DEL PODER JUDICIAL DE LA FEDERACIÓN 2024-2025; ASIMISMO, SE COMISIONAN, REUBICAN Y READSCRIBEN, A PERSONAS FUNCIONARIAS DE LOS ÓRGANOS JURISDICCIONALES, SE DESIGNAN Y, EN SU CASO, PRORROGAN A PERSONAS SECRETARIAS EN FUNCIONES DE PERSONAS JUZGADORAS, mediante publicación realizada el catorce de septiembre de dos mil veinticinco, en el Diario Oficial de la Federación, se adscribió a este órgano de control constitucional a los Magistrados Luis Ávalos García, Dulce Concepción Arias Garay y Atziri Sánchez García.
Por ende, con fundamento en lo dispuesto por el artículo 21 de la Ley Orgánica del Poder Judicial de la Federación, a partir del dieciséis de septiembre de dos mil veinticinco, este Tribunal Colegiado quedó integrado por los Magistrados Luis Ávalos García, Dulce Concepción Arias Garay y Atziri Sánchez García.
En razón de la nueva integración de este Tribunal Colegiado, con fundamento en lo dispuesto por el artículo 183 de la Ley de Amparo, retúrnese este expediente a la Magistrada Dulce Concepción Arias Garay. 
Hágase del conocimiento de las partes que de actualizarse algún impedimento podrá formularse hasta antes de celebrada la sesión en la que se resuelva el asunto. 
NOTIFÍQUESE POR LISTA ELECTRÓNICA."
https://www.dgej.cjf.gob.mx/siseinternet/reportes/vercaptura.aspx?tipoasunto=16&organismo=1886&expediente=39/2024&tipoprocedimiento=0,25-03-2024,26-03-2024,39/2024,"SE ADMITE el recurso de revisión fiscal interpuesto.
Para efectos de incluir este asunto en el sorteo a los Magistrados integrantes de este órgano jurisdiccional, obsérvese que haya transcurrido el plazo de quince días que otorga el artículo 63 penúltimo  ...","SE ADMITE el recurso de revisión fiscal interpuesto.
Para efectos de incluir este asunto en el sorteo a los Magistrados integrantes de este órgano jurisdiccional, obsérvese que haya transcurrido el plazo de quince días que otorga el artículo 63 penúltimo párrafo de la Ley Federal de Procedimiento Contencioso Administrativo, para que las partes ejerzan el derecho de adherirse al recurso de que se trata. 
Finalmente, hágase del conocimiento que este tribunal colegiado se encuentra integrado por los Magistrados Silvia Rocío Pérez Alvarado, Óscar Naranjo Ahumada y Mario Alberto Domínguez Trejo."
https://www.dgej.cjf.gob.mx/siseinternet/reportes/vercaptura.aspx?tipoasunto=16&organismo=1886&expediente=39/2024&tipoprocedimiento=0,15-05-2024,16-05-2024,39/2024,"Túrnense los presentes autos a la ponencia a cargo del Magistrado Mario Alberto Domínguez Trejo, para que se emita el proyecto de resolución correspondiente; ello, en términos del artículo 183 de la Ley de Amparo.","Túrnense los presentes autos a la ponencia a cargo del Magistrado Mario Alberto Domínguez Trejo, para que se emita el proyecto de resolución correspondiente; ello, en términos del artículo 183 de la Ley de Amparo."
https://www.dgej.cjf.gob.mx/siseinternet/reportes/vercaptura.aspx?tipoasunto=16&organismo=1886&expediente=39/2024&tipoprocedimiento=0,29-04-2025,30-04-2025,39/2024,"Hágase del conocimiento a las partes del presente asunto,
que este Tribunal Colegiado está integrado por el Magistrado Mario Alberto
Domínguez Trejo (Ponencia ""A""); Secretario en funciones de Magistrado
Manuel Antonio Figueroa Vega (Ponencia ""B""); y, Magi ...","Hágase del conocimiento a las partes del presente asunto,
que este Tribunal Colegiado está integrado por el Magistrado Mario Alberto
Domínguez Trejo (Ponencia ""A""); Secretario en funciones de Magistrado
Manuel Antonio Figueroa Vega (Ponencia ""B""); y, Magistrada Silvia Rocio
Pérez Alvarado (Ponencia ""C"").
Se ordena devolver autos a ponencia de origen."
https://www.dgej.cjf.gob.mx/siseinternet/reportes/vercaptura.aspx?tipoasunto=16&organismo=1886&expediente=39/2024&tipoprocedimiento=0,19-06-2025,20-06-2025,39/2024,"Hágase del conocimiento a las partes del presente asunto, que este Tribunal Colegiado está integrado por el Magistrado Mario Alberto Domínguez Trejo (Ponencia ""A""); Secretario en funciones de Magistrado Manuel Antonio Figueroa Vega (Ponencia ""B""); y, Magi ...","Hágase del conocimiento a las partes del presente asunto, que este Tribunal Colegiado está integrado por el Magistrado Mario Alberto Domínguez Trejo (Ponencia ""A""); Secretario en funciones de Magistrado Manuel Antonio Figueroa Vega (Ponencia ""B""); y, Magistrado Luis Armando Pérez Topete (Ponencia ""C""). 
Una vez notificado el presente proveído, devuélvase el presente asunto a la ponencia de origen."
https://www.dgej.cjf.gob.mx/siseinternet/reportes/vercaptura.aspx?tipoasunto=16&organismo=1886&expediente=39/2024&tipoprocedimiento=0,20-08-2025,28-08-2025,39/2024,"ÚNICO. Se desecha el recurso de revisión fiscal
interpuesto por el Jefe del Servicio de Administración Tributaria;
el Secretario de Hacienda y Crédito Público y la autoridad
demandada.","ÚNICO. Se desecha el recurso de revisión fiscal
interpuesto por el Jefe del Servicio de Administración Tributaria;
el Secretario de Hacienda y Crédito Público y la autoridad
demandada."
https://www.dgej.cjf.gob.mx/siseinternet/reportes/vercaptura.aspx?tipoasunto=16&organismo=1886&expediente=39/2024&tipoprocedimiento=0,11-09-2025,12-09-2025,39/2024,"Autoridad acusa recibo de constancias. 
Archívese el presente como asunto concluido.","Autoridad acusa recibo de constancias. 
Archívese el presente como asunto concluido."
https://www.dgej.cjf.gob.mx/siseinternet/reportes/vercaptura.aspx?tipoasunto=1&organismo=5747&expediente=884/2024&tipoprocedimiento=0,06-11-2024,29-11-2024,884/2024,"Este juzgado de Distrito, es competente para tramitar, el juicio de amparo 455/2023, del índice del extinto Juzgado Decimoséptimo de Distrito en Materias Administrativa, Civil y de Trabajo, con sede en la misma ciudad; se reanudan los términos y plazos pr ...","Este juzgado de Distrito, es competente para tramitar, el juicio de amparo 455/2023, del índice del extinto Juzgado Decimoséptimo de Distrito en Materias Administrativa, Civil y de Trabajo, con sede en la misma ciudad; se reanudan los términos y plazos procesales. Existe recurso de revisión, se reserva notificar a las partes la presente actuación, hasta que se reciba la resolución de dicho recurso y se pueda actuar en consecuencia."
https://www.dgej.cjf.gob.mx/siseinternet/reportes/vercaptura.aspx?tipoasunto=1&organismo=5747&expediente=884/2024&tipoprocedimiento=0,12-03-2025,13-03-2025,884/2024,"Tribunal de Alzada, remite resolución: ""PRIMERO. Queda firme el primer punto resolutivo de la sentencia recurrida."". ""SEGUNDO. En la materia de la revisión, se modifica parcialmente el fallo impugnado."" ""TERCERO. La Justicia de la Unión no ampara ni prote ...","Tribunal de Alzada, remite resolución: ""PRIMERO. Queda firme el primer punto resolutivo de la sentencia recurrida."". ""SEGUNDO. En la materia de la revisión, se modifica parcialmente el fallo impugnado."" ""TERCERO. La Justicia de la Unión no ampara ni protege"" Requiérase a la responsable para que, en tres días, de cumplimiento al fallo protector."
https://www.dgej.cjf.gob.mx/siseinternet/reportes/vercaptura.aspx?tipoasunto=1&organismo=5747&expediente=884/2024&tipoprocedimiento=0,19-03-2025,20-03-2025,884/2024,"Tribunal de Alzada, declara sin materia el recurso de revisión incidental.","Tribunal de Alzada, declara sin materia el recurso de revisión incidental."
https://www.dgej.cjf.gob.mx/siseinternet/reportes/vercaptura.aspx?tipoasunto=1&organismo=5747&expediente=884/2024&tipoprocedimiento=0,31-03-2025,01-04-2025,884/2024,"Autoridad responsable, informa el cumplimiento con la ejecutoria de amparo, resérvese dar vista a las partes, hasta que la totalidad de las autoridades responsables informen el cumplimiento dado a la ejecutoria.","Autoridad responsable, informa el cumplimiento con la ejecutoria de amparo, resérvese dar vista a las partes, hasta que la totalidad de las autoridades responsables informen el cumplimiento dado a la ejecutoria."
https://www.dgej.cjf.gob.mx/siseinternet/reportes/vercaptura.aspx?tipoasunto=1&organismo=5747&expediente=884/2024&tipoprocedimiento=0,21-04-2025,22-04-2025,884/2024,"Como lo solicita la superioridad, acúsese de recibo dicho comunicado.","Como lo solicita la superioridad, acúsese de recibo dicho comunicado."
https://www.dgej.cjf.gob.mx/siseinternet/reportes/vercaptura.aspx?tipoasunto=1&organismo=5747&expediente=884/2024&tipoprocedimiento=0,23-04-2025,24-04-2025,884/2024,"Requiérase a las responsables, para que en tres días, den cumplimiento al fallo protector.","Requiérase a las responsables, para que en tres días, den cumplimiento al fallo protector."
https://www.dgej.cjf.gob.mx/siseinternet/reportes/vercaptura.aspx?tipoasunto=1&organismo=5747&expediente=884/2024&tipoprocedimiento=0,29-04-2025,30-04-2025,884/2024,"Consejo Adjunto de Control Constitucional y de lo Contencioso de la Consejería  devuelve el comunicado 21028/2025; sin embargo, no se ordena emitir un nuevo comunicado, ya se giró el oficio a dicha autoridad.","Consejo Adjunto de Control Constitucional y de lo Contencioso de la Consejería  devuelve el comunicado 21028/2025; sin embargo, no se ordena emitir un nuevo comunicado, ya se giró el oficio a dicha autoridad."
https://www.dgej.cjf.gob.mx/siseinternet/reportes/vercaptura.aspx?tipoasunto=1&organismo=5747&expediente=884/2024&tipoprocedimiento=0,07-05-2025,08-05-2025,884/2024,"Responsable manifiesta que en la revisión 287/2023, se confirmó el sobreseimiento respecto de dicha autoridad por lo que no le corresponde el cumplimiento de la sentencia de amparo.","Responsable manifiesta que en la revisión 287/2023, se confirmó el sobreseimiento respecto de dicha autoridad por lo que no le corresponde el cumplimiento de la sentencia de amparo."
https://www.dgej.cjf.gob.mx/siseinternet/reportes/vercaptura.aspx?tipoasunto=1&organismo=5747&expediente=884/2024&tipoprocedimiento=0,08-05-2025,09-05-2025,884/2024,Responsable informa las gestiones para dar cumplimiento a la ejecutoria de amparo..,Responsable informa las gestiones para dar cumplimiento a la ejecutoria de amparo..
