URL origen,Fecha de auto,Fecha de publicación,Número de expediente,Resumen,Síntesis completa
https://www.dgej.cjf.gob.mx/siseinternet/reportes/vercaptura.aspx?tipoasunto=10&organismo=473&expediente=164/2025&tipoprocedimiento=0,15-05-2025,16-05-2025,164/2025,"Zapopan, Jalisco, a quince de mayo de dos mil veinticinco.
Visto el estado procesal que guarda este expediente, de conformidad con el artículo 183 de la Ley de Amparo, se TURNAN estos autos para que formule el proyecto de resolución al magistrado Julio Ed ...","Zapopan, Jalisco, a quince de mayo de dos mil veinticinco.
Visto el estado procesal que guarda este expediente, de conformidad con el artículo 183 de la Ley de Amparo, se TURNAN estos autos para que formule el proyecto de resolución al magistrado Julio Eduardo Díaz Sánchez.
Notifíquese.
Lo acordó y firma el Magistrado Presidente del Tercer Tribunal Colegiado en Materia Administrativa del Tercer Circuito, ante la Secretaria de Acuerdos, quien autoriza y da fe."
https://www.dgej.cjf.gob.mx/siseinternet/reportes/vercaptura.aspx?tipoasunto=10&organismo=473&expediente=164/2025&tipoprocedimiento=0,20-08-2025,21-08-2025,164/2025,"Zapopan, Jalisco, a veinte de agosto de dos mil veinticinco.
En atención al oficio SEADS/2228/2025, de once de junio de dos mil veinticinco, del Secretario Técnico de la Comisión de Adscripción encargado del despacho de la Secretaría Ejecutiva de Adscripc ...","Zapopan, Jalisco, a veinte de agosto de dos mil veinticinco.
En atención al oficio SEADS/2228/2025, de once de junio de dos mil veinticinco, del Secretario Técnico de la Comisión de Adscripción encargado del despacho de la Secretaría Ejecutiva de Adscripción del Consejo de la Judicatura Federal, mediante el cual comunicó que en sesión ordinaria de esa misma fecha, el propio Pleno del Consejo acordó la reincorporación del magistrado que suscribe este acuerdo (Jacob Troncoso Ávila), a este Tercer Tribunal Colegiado en Materia Administrativa del Tercer Circuito, con efectos a partir del dieciséis de agosto del año que transcurre.
Asimismo, mediante diverso oficio SEADS/3100/2025, de catorce de agosto de dos mil veinticinco, del citado Secretario Técnico, se hizo del conocimiento que en sesión extraordinaria de catorce de agosto último, el Pleno del Consejo designó a la licenciada Nadia Cecilia Lupita Licón González, como secretaria en funciones de magistrada, en sustitución del magistrado José Luis Gómez Avilés, con motivo de su jubilación. 
Por consiguiente, se hace del conocimiento, que este Tribunal Colegiado se encuentra INTEGRADO por los licenciados Nadia Cecilia Lupita Licón González y Raúl Octavio González Cervantes, como secretaria y secretario en funciones de magistrada y magistrado y el magistrado Jacob Troncoso Ávila, a quien se returna este expediente.
Notifíquese.
Lo acordó y firma el Magistrado Presidente del Tercer Tribunal Colegiado en Materia Administrativa del Tercer Circuito, ante la Secretaria de Acuerdos quien autoriza y da fe."
https://www.dgej.cjf.gob.mx/siseinternet/reportes/vercaptura.aspx?tipoasunto=10&organismo=473&expediente=164/2025&tipoprocedimiento=0,17-09-2025,18-09-2025,164/2025,"Zapopan, Jalisco, a diecisiete de septiembre de dos mil veinticinco.
De conformidad con lo dispuesto en el ""Acuerdo General del Pleno del Órgano de Administración Judicial por el que se adscriben a las personas electas en el Proceso Electoral Extraordinar ...","Zapopan, Jalisco, a diecisiete de septiembre de dos mil veinticinco.
De conformidad con lo dispuesto en el ""Acuerdo General del Pleno del Órgano de Administración Judicial por el que se adscriben a las personas electas en el Proceso Electoral Extraordinario a diversos cargos del Poder Judicial de la Federación 2024-2025; asimismo, se comisionan, reubican y readscriben a personas funcionarias de los Órganos Jurisdiccionales, se designan y, en su caso, prorrogan a personas secretarias en funciones de Personas Juzgadoras"", publicado en el Diario Oficial de la Federación el catorce de septiembre de dos mil veinticinco, se hace de su conocimiento que este órgano jurisdiccional se encuentra integrado por la magistrada Sandra Elizabeth Ramírez Aguilera y los magistrados Alberto Carrillo Ruvalcaba y el que suscribe este acuerdo (Jacob Troncoso Ávila).
Notifíquese.
Lo acordó y firma el Magistrado Presidente del Tercer Tribunal Colegiado en Materia Administrativa del Tercer Circuito, ante la Secretaria de Acuerdos quien autoriza y da fe."
https://www.dgej.cjf.gob.mx/siseinternet/reportes/vercaptura.aspx?tipoasunto=16&organismo=1386&expediente=25/2025&tipoprocedimiento=0,04-02-2025,06-02-2025,25/2025,Se admite el medio de impugnación. Se tiene como domicilio para recibir notificaciones el que índica y como delegados a las personas que propone. Para efectos de incluir este asunto en el sorteo a los Magistrados integrantes de este órgano jurisdiccional; ...,"Se admite el medio de impugnación. Se tiene como domicilio para recibir notificaciones el que índica y como delegados a las personas que propone. Para efectos de incluir este asunto en el sorteo a los Magistrados integrantes de este órgano jurisdiccional; obsérvese que haya transcurrido el plazo de quince días que otorga el artículo 63 de la Ley Federal de Procedimiento Contencioso Administrativo, penúltimo párrafo, para que las partes expresen agravios correspondientes o ejerzan el derecho de adherirse al recurso de que se trata. Hágase del conocimiento de las partes, que las resoluciones que se emitan en el presente procedimiento serán publicadas y podrán ser difundidas a terceros en términos de la normatividad aplicable, atento al principio de máxima publicidad.
No obstante lo anterior, indíquese que los datos personales o sensibles serán suprimidos por este órgano jurisdiccional. Se ordena formar el expediente electrónico, relativo al presente asunto."
https://www.dgej.cjf.gob.mx/siseinternet/reportes/vercaptura.aspx?tipoasunto=16&organismo=1386&expediente=25/2025&tipoprocedimiento=0,28-03-2025,31-03-2025,25/2025,"Se turna este asunto para que formule el proyecto de resolución correspondiente al magistrado que suscribe este acuerdo Jorge Héctor Cortés Ortiz.
Visto el oficio de cuenta SEADS/813/2025 de doce de marzo de dos mil veinticinco, firmado electrónicamente p ...","Se turna este asunto para que formule el proyecto de resolución correspondiente al magistrado que suscribe este acuerdo Jorge Héctor Cortés Ortiz.
Visto el oficio de cuenta SEADS/813/2025 de doce de marzo de dos mil veinticinco, firmado electrónicamente por Secretario Técnico AA de la Comisión de Adscripción, encargado del despacho de la Secretaría Ejecutiva de Adscripción del Consejo de la Judicatura Federal, por medio del cual comunica que, de conformidad con lo dispuesto en el artículo 174, párrafo segundo, del Acuerdo General de Carrera Judicial, en congruencia con el artículo 30 de la abrogada Ley Orgánica del Poder Judicial de la Federación, en relación con los numerales V.2.5., V.2.6. y V.2.8. de los Lineamientos para integrar las listas de personas habilitadas para sustituir a magistradas y magistrados de Circuito, juezas y jueces de Distrito, en casos de ausencias temporales superiores a quince días y en casos de impedimentos, el Pleno del Consejo de la Judicatura Federal en sesión celebrada el doce del mencionado mes y año, acordó autorizar a Ricardo Manuel Gómez Núñez como secretario en funciones de magistrado, en sustitución del magistrado Oscar Hernández Peraza, con efectos a partir del dieciséis de marzo y hasta el quince de agosto de la referida anualidad, o antes si el Pleno del Consejo de la Judicatura Federal así lo determina; en tales circunstancias, hágase saber lo anterior a las partes, para los efectos previstos por los artículos 51 y 52 de la Ley de Amparo.
En relación con lo anterior, cobra aplicación por analogía la Jurisprudencia de la Segunda Sala, identificable en el Tomo XXXII, Julio de 2010, tesis 2a./J.104/2010, página 312, del Semanario Judicial de la Federación y su Gaceta con el número de registro 164217, cuyo rubro dice: ""SENTENCIA DE AMPARO INDIRECTO. EL CAMBIO DE TITULAR DEL ÓRGANO QUE LA DICTARÁ DEBE NOTIFICARSE A LAS PARTES, PUES DE LO CONTRARIO SE ACTUALIZA UNA VIOLACIÓN PROCESAL QUE AMERITA REPONER EL PROCEDIMIENTO, SIEMPRE QUE SE HAGA VALER EN LOS AGRAVIOS DEL RECURSO DE REVISIÓN EL ARGUMENTO REFERENTE AL IMPEDIMENTO DEL JUEZ A QUO PARA CONOCER DEL ASUNTO"".
En tal virtud, este tribunal colegiado estará integrado por el magistrado Jorge Héctor Cortés Ortiz (presidente), y los secretarios en funciones de magistrados Yuridia Arias Álvarez y Ricardo Manuel Gómez Núñez."
https://www.dgej.cjf.gob.mx/siseinternet/reportes/vercaptura.aspx?tipoasunto=16&organismo=1386&expediente=25/2025&tipoprocedimiento=0,08-10-2025,09-10-2025,25/2025,"Visto el oficio SEADS/1232/2025 de nueve de abril de dos mil veinticinco firmado electrónicamente por el Secretario Técnico de la Comisión de Adscripción, encargado del despacho de la Secretaría Ejecutiva de Adscripción del Consejo de la Judicatura Federa ...","Visto el oficio SEADS/1232/2025 de nueve de abril de dos mil veinticinco firmado electrónicamente por el Secretario Técnico de la Comisión de Adscripción, encargado del despacho de la Secretaría Ejecutiva de Adscripción del Consejo de la Judicatura Federal, mediante el cual informa que el Pleno del Consejo de la Judicatura Federal en sesión celebrada el nueve de abril del año en curso acordó la adscripción definitiva del Magistrado Julio César Ortiz Mendoza del Primer Tribunal Colegiado en Materia de Trabajo del Tercer Circuito, con residencia en Zapopan, Jalisco, a este Quinto Tribunal Colegiado en Materia Administrativa del Tercer Circuito, con residencia en Zapopan, Jalisco, en sustitución del Magistrado Oscar Hernández Peraza (quien se jubiló el uno de marzo del año en curso), con efectos a partir del uno de mayo del presente año y hasta que el Pleno del Consejo de la Judicatura Federal o el órgano que lo sustituya lo determine, lo anterior, tomándose en consideración la Ley de Carrera Judicial del Poder Judicial de la Federación y el Acuerdo General del Pleno del Consejo de la Judicatura Federal que Reglamenta la Carrera Judicial.
Así mismo, respecto al  ""Acuerdo General del Pleno del Órgano de Administración Judicial por el que se adscriben a las personas electas en el Proceso Electoral Extraordinario a diversos cargos del Poder Judicial de la Federación 2024-2025, asimismo, se comisionan, reubican y readscriben, a personas funcionarias de los Órganos Jurisdiccionales, se designan y, en su caso, prorrogan a personas secretarias en funciones de Personas Juzgadoras"", publicado en el Diario Oficial de la Federación el catorce de septiembre del año en curso,  se comunica, que en el Pleno del referido Órgano de Administración en sesión extraordinaria número 4/2025 celebrada el doce del referido mes de septiembre, se acordó la adscripción de la Magistrada Teresa Márquez Sánchez a este Quinto Tribunal Colegiado en Materia Administrativa del Tercer Circuito, con residencia en Zapopan, Jalisco, en el entendido, que dicha adscripción es con efectos a partir del dieciséis de septiembre del año que transcurre, de conformidad con el Aviso General de fecha quince del multicitado mes de septiembre, firmado por el Secretario Ejecutivo de Adscripción del Órgano de Administración Judicial y con el listado que obra en el enlace contenido en dicho Aviso.
Hágase saber el contenido de este acuerdo a las partes, para los efectos previstos por los artículos 51 y 52 de la Ley de Amparo.
Resulta aplicable por analogía, la Jurisprudencia de la Segunda Sala, identificable en el Tomo XXXII, Julio de 2010, tesis 2a./J.104/2010, página 312, del Semanario Judicial de la Federación y su Gaceta con el número de registro 164217.
En tal virtud, este tribunal colegiado estará integrado por el Magistrado Jorge Héctor Cortés Ortiz (presidente), por la Magistrada Teresa Márquez Sánchez y por el Magistrado Julio César Ortiz Mendoza."
https://www.dgej.cjf.gob.mx/siseinternet/reportes/vercaptura.aspx?tipoasunto=11&organismo=1887&expediente=300/2024&tipoprocedimiento=0,13-06-2024,14-06-2024,300/2024,"Visto lo de cuenta, se provee: fórmese el recurso de revisión incidental  Acúsese de recibo.Regístrese en el Sistema Integral de Seguimiento de Expedientes, así como en el Libro Electrónico correspondiente, de conformidad con el artículo 99 del Acuerdo Ge ...","Visto lo de cuenta, se provee: fórmese el recurso de revisión incidental  Acúsese de recibo.Regístrese en el Sistema Integral de Seguimiento de Expedientes, así como en el Libro Electrónico correspondiente, de conformidad con el artículo 99 del Acuerdo General del Pleno del Consejo de la Judicatura Federal que establece las disposiciones en materia de actividad administrativa de los órganos jurisdiccionales. Ténganse por recibido el oficio, signado por la Secretaria Encargada del Despacho del Juzgado Decimosexto de Distrito en Materias Administrativa, Civil y de Trabajo en el Estado de Jalisco, con el que remite el recurso de revisión incidental interpuesto por el Titular de la Oficina del Abogado General de la Secretaría de Agricultura y Desarrollo Rural, en representación del Titular de esa dependencia, contra la interlocutoria pronunciada el veintiséis de marzo del año en curso, en los autos del incidente de suspensión relativo al juicio de amparo indirecto, del índice del citado juzgado.Por otra parte, vista la certificación de cuenta en la que se hace constar que de una revisión en el Sistema Integral de Seguimiento de Expedientes, se aprecia que el expediente electrónico correspondiente al incidente de suspensión relativo al juicio de amparo indirecto, sí se encuentra disponible para ser visualizado por este Tribunal; por tanto, de conformidad con el artículo 26 del Acuerdo General 12/2020 del Pleno del Consejo de la Judicatura Federal, que regula la integración y trámite de expediente electrónico y el uso de videoconferencias en todos los asuntos competencia de los órganos jurisdiccionales a cargo del propio Consejo, las constancias que integran el mismo, pueden ser consultadas en el expediente electrónico relativo al presente recurso.Ahora bien, vista la certificación de cuenta, en la que se hizo consta, que en el expediente electrónico en cita, del recurso interpuesto por la autoridad recurrente, no se advierte el sobre donde obre el sello de Correos de México del que se advierta la fecha de depósito del mismo, ya que se observa que éste tiene el sello de recepción en el Juzgado de Distrito de origen de ocho de mayo de dos mil veinticuatro, cuya interposición resultaría extemporánea, sin embargo, en razón de que el domicilio de la autoridad recurrente se encuentra fuera de la residencia de esta ciudad, hace suponer que el mismo se presentó vía mensajería.De igual forma, no obran en el expediente electrónico relativo al incidente de suspensión de origen, la totalidad de las constancias de notificación a las partes, del auto de quince de mayo pasado, en el que se tuvo por interpuesto el recurso de revisión de mérito, en específico, aquélla correspondiente a la parte quejosa.requiérase al Juzgado Decimosexto de Distrito en Materias Administrativa, Civil y de Trabajo en el Estado de Jalisco, de conformidad con el artículo 297, fracción II, del Código Federal de Procedimientos Civiles, de aplicación supletoria a la Ley de Amparo, para que, dentro del término de tres días contado a partir del día siguiente del en que surta efectos la notificación del presente proveído, remita el sobre de presentación del recurso de mérito, o bien, lo haga disponible para su consulta en el expediente electrónico de origen; asimismo, haga disponible para ser visualizadas por este tribunal, la totalidad de las constancias de notificación relativas al auto en que se tuvo por interpuesto el medio de impugnación en trato, en específico, la relativa a la parte quejosa.Se tiene a la autoridad responsable recurrente señalando como domicilio para oír y recibir notificaciones el que indica y como delegados a las personas que mencionan, de conformidad con el artículo 9 de la Ley de Amparo. se ordena formar el expediente electrónico relativo al presente asunto. se hace del conocimiento de las partes que, a fin de respetar el derecho a la intimidad, en la versión pública de la resolución que se dicte en el presente asunto se suprimirá la información que por normativa se clasifique como reservada, confidencial o datos personales, cuando así proceda.Por otra parte, de conformidad con lo establecido en el artículo 263 del Acuerdo General del Pleno del Consejo de la Judicatura Federal que establece las disposiciones en materia de actividad administrativa de los órganos jurisdiccionales,  se exhorta a las partes a fin de que, en la medida de lo posible, se haga uso de las herramientas tecnológicas a su alcance y se continúe la tramitación del caso mediante el esquema de ""juicio en línea"", a través de la utilización de la FIEL, FIREL o firma electrónica del SAT, por conducto del Portal de Servicios en Línea del Poder Judicial de la Federación. se habilitan días y horas inhábiles, tal y como lo estatuye el precepto 21 de la ley de la materia, para lograr las notificaciones, y el debido despacho, integración y resolución de los asuntos."
https://www.dgej.cjf.gob.mx/siseinternet/reportes/vercaptura.aspx?tipoasunto=11&organismo=1887&expediente=300/2024&tipoprocedimiento=0,21-06-2024,24-06-2024,300/2024,"Téngase por recibido el oficio signado por el Juez Decimosexto de Distrito en Materias Administrativa, Civil y de Trabajo en el Estado de Jalisco, por medio del cual manifiesta que cumple con el requerimiento que se le formuló en autos, y al efecto, infor ...","Téngase por recibido el oficio signado por el Juez Decimosexto de Distrito en Materias Administrativa, Civil y de Trabajo en el Estado de Jalisco, por medio del cual manifiesta que cumple con el requerimiento que se le formuló en autos, y al efecto, informa que se encuentra integrado el recurso de revisión a que alude, y remite las constancias del incidente de suspensión de su estadística. 
Vista la certificación de cuenta, de la que se advierte de una consulta de las actuaciones remitidas, así como del panel de notificaciones relativo al incidente de suspensión de referencia, se advierte que aún no obra la totalidad de constancias de notificación. En consecuencia, requiérasele por segunda ocasión para que dentro del plazo de tres días, contado a partir de que surta efectos la notificación del presente proveído, remita el sobre de presentación del recurso de mérito, o bien, lo haga disponible para su consulta en el expediente electrónico de origen; asimismo, haga disponible para ser visualizadas por este tribunal, la totalidad de las constancias de notificación indicadas; en la inteligencia de que una vez que cumpla con lo anterior, deberá remitirlo nuevamente a este órgano colegiado. Bajo apercibimiento que de no cumplir con lo solicitado, se le impondrá multa."
https://www.dgej.cjf.gob.mx/siseinternet/reportes/vercaptura.aspx?tipoasunto=11&organismo=1887&expediente=300/2024&tipoprocedimiento=0,27-06-2024,28-06-2024,300/2024,"Visto el oficio, por medio del cual cumple con el requerimiento que se le formuló en autos, hace visible las constancias solicitadas por este tribunal y remite el sobre de presentación del recurso hecho valer por la autoridad recurrente; lo que se ordena  ...","Visto el oficio, por medio del cual cumple con el requerimiento que se le formuló en autos, hace visible las constancias solicitadas por este tribunal y remite el sobre de presentación del recurso hecho valer por la autoridad recurrente; lo que se ordena agregar a los autos para los efectos legales procedentes. Regístrese en el Sistema Integral de Seguimiento de Expedientes, así como en el Libro Electrónico correspondiente. Se admite el recurso de revisión incidental interpuesto. Dese la intervención que legalmente le corresponde al Agente del Ministerio Público de la Federación adscrito. Para efectos de realizar el turno del presente asunto, obsérvese que haya transcurrido el plazo."
https://www.dgej.cjf.gob.mx/siseinternet/reportes/vercaptura.aspx?tipoasunto=11&organismo=1887&expediente=300/2024&tipoprocedimiento=0,21-11-2024,22-11-2024,300/2024,"Túrnese a la ponencia a cargo del suscrito Magistrado Moisés Muñoz Padilla, para la elaboración del proyecto de sentencia, en atención al sorteo de turno de asuntos realizado en este tribunal.","Túrnese a la ponencia a cargo del suscrito Magistrado Moisés Muñoz Padilla, para la elaboración del proyecto de sentencia, en atención al sorteo de turno de asuntos realizado en este tribunal."
https://www.dgej.cjf.gob.mx/siseinternet/reportes/vercaptura.aspx?tipoasunto=11&organismo=1887&expediente=300/2024&tipoprocedimiento=0,10-12-2024,11-12-2024,300/2024,"Téngase por recibido el oficio signado por el Secretario encargado del despacho del Juzgado Cuarto de Distrito en Materia de Trabajo en el Estado de Jalisco, con residencia en Zapopan, por medio del cual informa el cambio de denominación de los Juzgados d ...","Téngase por recibido el oficio signado por el Secretario encargado del despacho del Juzgado Cuarto de Distrito en Materia de Trabajo en el Estado de Jalisco, con residencia en Zapopan, por medio del cual informa el cambio de denominación de los Juzgados de Distrito, por tal motivo el expediente 564/2024, del orden del antes denominado Juzgado Decimosexto de Distrito en Materias Administrativa, Civil y de Trabajo en el Estado de Jalisco, radica en el Juzgado Cuarto de Distrito en Materia de Trabajo en el Estado de Jalisco, con residencia en Zapopan, con el número 143/2024. Glósese el comunicado de cuenta para que obre como corresponda. Se toma nota de que a partir del dos de septiembre del mismo año, con la nueva especialización, conoce del asunto del que deriva el presente recurso; Se instruye a cualesquiera de los Actuarios Judiciales adscritos a este órgano colegiado a fin de que la entrega de los comunicados que se expidan y dirijan al Juzgado oficiante, sean entregados en el propio órgano jurisdiccional de conocimiento actual. Se instruye al Oficial Judicial ""A"", adscrito a este Tribunal Colegiado, a fin de que modifique el registro relativo al Juzgado Federal de conocimiento del asunto de origen en el Sistema Integral de Seguimiento de Expedientes, a fin de que los comunicados que con posterioridad se emitan, se generen al destinatario correcto."
https://www.dgej.cjf.gob.mx/siseinternet/reportes/vercaptura.aspx?tipoasunto=11&organismo=1887&expediente=300/2024&tipoprocedimiento=0,15-01-2025,07-02-2025,300/2024,"Por lo expuesto y fundado, se 
RESUELVE:
PRIMERO. Este Séptimo Tribunal Colegiado 
en Materia Administrativa del Tercer Circuito carece de 
competencia legal, por razón de la materia, para conocer y 
resolver el presente asunto.
SEGUNDO. Se ordena remitir ...","Por lo expuesto y fundado, se 
RESUELVE:
PRIMERO. Este Séptimo Tribunal Colegiado 
en Materia Administrativa del Tercer Circuito carece de 
competencia legal, por razón de la materia, para conocer y 
resolver el presente asunto.
SEGUNDO. Se ordena remitir el expediente 
de revisión incidental en que se actúa, con sus anexos, al 
Tribunal Colegiado en Materia de Trabajo de este Tercer 
Circuito, en turno, por conducto de la Oficina de 
Correspondencia Común de dichos órganos jurisdiccionales."
https://www.dgej.cjf.gob.mx/siseinternet/reportes/vercaptura.aspx?tipoasunto=11&organismo=1887&expediente=300/2024&tipoprocedimiento=0,17-02-2025,18-02-2025,300/2024,"Téngase por recibido el oficio, mediante el cual acusa recibo del comunicado con el que se le remitió testimonio de la resolución pronunciada en el presente asunto, en donde se planteó la incompetencia legal de este Tribunal para conocer del asunto.
Glóse ...","Téngase por recibido el oficio, mediante el cual acusa recibo del comunicado con el que se le remitió testimonio de la resolución pronunciada en el presente asunto, en donde se planteó la incompetencia legal de este Tribunal para conocer del asunto.
Glósese el comunicado de cuenta para que obre como y estese en espera de que el Tribunal Colegiado en Materia de Trabajo del Tercer Circuito en turno, informe lo relativo a la competencia declinada por este Órgano Colegiado"
https://www.dgej.cjf.gob.mx/siseinternet/reportes/vercaptura.aspx?tipoasunto=11&organismo=1887&expediente=300/2024&tipoprocedimiento=0,13-03-2025,14-03-2025,300/2024,"Visto el estado procesal que guarda el presente asunto, del que se desprende que por resolución de quince de enero de dos mil veinticinco, se ordenó remitir el presente recurso a la Oficina de Correspondencia Común de los Tribunales Colegiados en Materia  ...","Visto el estado procesal que guarda el presente asunto, del que se desprende que por resolución de quince de enero de dos mil veinticinco, se ordenó remitir el presente recurso a la Oficina de Correspondencia Común de los Tribunales Colegiados en Materia de Trabajo del Tercer Circuito; asimismo, que de la consulta que se realiza en el Sistema Integral de Seguimiento de Expedientes ""SISE"", se desprende que correspondió conocer y resolver del recurso al Segundo Tribunal Colegiado en Materia de Trabajo del Tercer Circuito, quien lo registró con el consecutivo, de su índice y lo tuvo por admitido el seis de marzo del año en curso.Por tanto, toda vez que no existe algún trámite pendiente que realizar, archívese como asunto concluido. se determina que procede la destrucción del expediente"
