URL origen,Fecha de auto,Fecha de publicación,Número de expediente,Resumen,Síntesis completa
https://www.dgej.cjf.gob.mx/siseinternet/reportes/vercaptura.aspx?tipoasunto=1&organismo=3890&expediente=1457/2022&tipoprocedimiento=0,,,,"Error general: HTTPSConnectionPool(host='www.dgej.cjf.gob.mx', port=443): Read timed out. (read timeout=10)",
https://www.dgej.cjf.gob.mx/siseinternet/reportes/vercaptura.aspx?tipoasunto=16&organismo=795&expediente=147/2024&tipoprocedimiento=0,,,,"Error general: HTTPSConnectionPool(host='www.dgej.cjf.gob.mx', port=443): Read timed out. (read timeout=10)",
https://www.dgej.cjf.gob.mx/siseinternet/reportes/vercaptura.aspx?tipoasunto=10&organismo=127&expediente=123/2025&tipoprocedimiento=0,,,,"Error general: HTTPSConnectionPool(host='www.dgej.cjf.gob.mx', port=443): Read timed out. (read timeout=10)",
https://www.dgej.cjf.gob.mx/siseinternet/reportes/vercaptura.aspx?tipoasunto=1&organismo=5741&expediente=1155/2025&tipoprocedimiento=0,,,,"Error general: HTTPSConnectionPool(host='www.dgej.cjf.gob.mx', port=443): Read timed out. (read timeout=10)",
https://www.dgej.cjf.gob.mx/siseinternet/reportes/vercapt95ura.aspx?tipoasunto=16&organismo=1886&expediente=14/2024&tipoprocedimiento=0,,,,Error general: 404 Client Error: Not Found for url: https://www.dgej.cjf.gob.mx/siseinternet/reportes/vercapt95ura.aspx?tipoasunto=16&organismo=1886&expediente=14/2024&tipoprocedimiento=0,
https://www.dgej.cjf.gob.mx/siseinternet/reportes/vercaptura.aspx?tipoasunto=16&organismo=1379&expediente=195/2024&tipoprocedimiento=0,,,,"Error general: HTTPSConnectionPool(host='www.dgej.cjf.gob.mx', port=443): Read timed out. (read timeout=10)",
https://www.dgej.cjf.gob.mx/siseinternet/reportes/vercaptura.aspx?tipoasunto=16&organismo=795&expediente=31/2025&tipoprocedimiento=0,,,,"Error general: HTTPSConnectionPool(host='www.dgej.cjf.gob.mx', port=443): Read timed out. (read timeout=10)",
https://www.dgej.cjf.gob.mx/siseinternet/reportes/vercaptura.aspx?tipoasunto=16&organismo=1886&expediente=111/2024&tipoprocedimiento=0,,,,"Error general: HTTPSConnectionPool(host='www.dgej.cjf.gob.mx', port=443): Read timed out. (read timeout=10)",
https://www.dgej.cjf.gob.mx/siseinternet/reportes/vercaptura.aspx?tipoasunto=16&organismo=795&expediente=32/2024&tipoprocedimiento=0,,,,"Error general: HTTPSConnectionPool(host='www.dgej.cjf.gob.mx', port=443): Read timed out. (read timeout=10)",
https://www.dgej.cjf.gob.mx/siseinternet/reportes/vercaptura.aspx?tipoasunto=16&organismo=795&expediente=43/2024&tipoprocedimiento=0,,,,"Error general: HTTPSConnectionPool(host='www.dgej.cjf.gob.mx', port=443): Read timed out. (read timeout=10)",
https://www.dgej.cjf.gob.mx/siseinternet/reportes/vercaptura.aspx?tipoasunto=10&organismo=102&expediente=196/2024&tipoprocedimiento=0,,,,"Error general: HTTPSConnectionPool(host='www.dgej.cjf.gob.mx', port=443): Read timed out. (read timeout=10)",
https://www.dgej.cjf.gob.mx/siseinternet/reportes/vercaptura.aspx?tipoasunto=10&organismo=795&expediente=359/2023&tipoprocedimiento=0,,,,"Error general: HTTPSConnectionPool(host='www.dgej.cjf.gob.mx', port=443): Read timed out. (read timeout=10)",
https://www.dgej.cjf.gob.mx/siseinternet/reportes/vercaptura.aspx?tipoasunto=16&organismo=1886&expediente=97/2024&tipoprocedimiento=0,,,,"Error general: HTTPSConnectionPool(host='www.dgej.cjf.gob.mx', port=443): Read timed out. (read timeout=10)",
https://www.dgej.cjf.gob.mx/siseinternet/reportes/vercaptura.aspx?tipoasunto=16&organismo=1887&expediente=70/2025&tipoprocedimiento=0,,,,"Error general: HTTPSConnectionPool(host='www.dgej.cjf.gob.mx', port=443): Read timed out. (read timeout=10)",
https://www.dgej.cjf.gob.mx/siseinternet/reportes/vercaptura.aspx?tipoasunto=11&organismo=399&expediente=1385/2023&tipoprocedimiento=0,,,,"Error general: HTTPSConnectionPool(host='www.dgej.cjf.gob.mx', port=443): Read timed out. (read timeout=10)",
https://www.dgej.cjf.gob.mx/siseinternet/reportes/vercaptura.aspx?tipoasunto=10&organismo=127&expediente=43/2025&tipoprocedimiento=0,,,,"Error general: HTTPSConnectionPool(host='www.dgej.cjf.gob.mx', port=443): Read timed out. (read timeout=10)",
https://www.dgej.cjf.gob.mx/siseinternet/reportes/vercaptura.aspx?tipoasunto=10&organismo=118&expediente=152/2025&tipoprocedimiento=0,,,,"Error general: HTTPSConnectionPool(host='www.dgej.cjf.gob.mx', port=443): Read timed out. (read timeout=10)",
https://www.dgej.cjf.gob.mx/siseinternet/reportes/vercaptura.aspx?tipoasunto=16&organismo=1386&expediente=106/2025&tipoprocedimiento=0,,,,"Error general: HTTPSConnectionPool(host='www.dgej.cjf.gob.mx', port=443): Read timed out. (read timeout=10)",
https://www.dgej.cjf.gob.mx/siseinternet/reportes/vercaptura.aspx?tipoasunto=11&organismo=795&expediente=287/2023&tipoprocedimiento=0,,,,"Error general: HTTPSConnectionPool(host='www.dgej.cjf.gob.mx', port=443): Read timed out. (read timeout=10)",
https://www.dgej.cjf.gob.mx/siseinternet/reportes/vercaptura.aspx?tipoasunto=16&organismo=1386&expediente=101/2024&tipoprocedimiento=0,,,,"Error general: HTTPSConnectionPool(host='www.dgej.cjf.gob.mx', port=443): Read timed out. (read timeout=10)",
https://www.dgej.cjf.gob.mx/siseinternet/reportes/vercaptura.aspx?tipoasunto=10&organismo=1386&expediente=47/2025&tipoprocedimiento=0,,,,"Error general: HTTPSConnectionPool(host='www.dgej.cjf.gob.mx', port=443): Read timed out. (read timeout=10)",
https://www.dgej.cjf.gob.mx/siseinternet/reportes/vercaptura.aspx?tipoasunto=16&organismo=1886&expediente=7/2025&tipoprocedimiento=0,,,,"Error general: HTTPSConnectionPool(host='www.dgej.cjf.gob.mx', port=443): Read timed out. (read timeout=10)",
https://www.dgej.cjf.gob.mx/siseinternet/reportes/vercaptura.aspx?tipoasunto=16&organismo=1386&expediente=110/2024&tipoprocedimiento=0,,,,"Error general: HTTPSConnectionPool(host='www.dgej.cjf.gob.mx', port=443): Read timed out. (read timeout=10)",
https://www.dgej.cjf.gob.mx/siseinternet/reportes/vercaptura.aspx?tipoasunto=10&organismo=1886&expediente=262/2024&tipoprocedimiento=0,12-07-2024,15-07-2024,262/2024,"SE ADMITE la demanda
de amparo formulada por la parte actora, contra de la sentencia
definitiva de veintiséis de abril de dos mil veinticuatro, dictada por
los Magistrados integrantes de la Primera Sala Regional de
Occidente del Tribunal Federal de Justic ...","SE ADMITE la demanda
de amparo formulada por la parte actora, contra de la sentencia
definitiva de veintiséis de abril de dos mil veinticuatro, dictada por
los Magistrados integrantes de la Primera Sala Regional de
Occidente del Tribunal Federal de Justicia Administrativa, en el
expediente 5231/23-07-01-8 de su índice.
Señala Domicilio y autorizados.
Se Autoriza acceso al expediente electrónico y
notificaciones electrónicas.
Se tiene a la autoridad responsable rindiendo su
informe justificado.
Se le reconoce el carácter de tercera interesada a
Administradora Desconcentrada de Auditoria Fiscal de Jalisco ""3"";
quien es parte demandada en el juicio de origen.
Intervención Agente del Ministerio Público y
autorización de días y horas inhábiles."
https://www.dgej.cjf.gob.mx/siseinternet/reportes/vercaptura.aspx?tipoasunto=10&organismo=1886&expediente=262/2024&tipoprocedimiento=0,31-07-2024,16-08-2024,262/2024,"Agréguese el alegato ministerial. Se tienen por hechas las manifestaciones que del mismo se desprenden. Una vez que se pronuncie resolución en el presente asunto, expídanse las copias que solicita el Agente del Ministerio Público Federal.","Agréguese el alegato ministerial. Se tienen por hechas las manifestaciones que del mismo se desprenden. Una vez que se pronuncie resolución en el presente asunto, expídanse las copias que solicita el Agente del Ministerio Público Federal."
https://www.dgej.cjf.gob.mx/siseinternet/reportes/vercaptura.aspx?tipoasunto=10&organismo=1886&expediente=262/2024&tipoprocedimiento=0,12-12-2024,13-12-2024,262/2024,"Se turnan los autos al Magistrado Oscar Naranjo Ahumada, para que se emita el proyecto de resolución correspondiente.","Se turnan los autos al Magistrado Oscar Naranjo Ahumada, para que se emita el proyecto de resolución correspondiente."
https://www.dgej.cjf.gob.mx/siseinternet/reportes/vercaptura.aspx?tipoasunto=10&organismo=1886&expediente=262/2024&tipoprocedimiento=0,11-04-2025,14-04-2025,262/2024,"Zapopan, Jalisco, a once de abril de dos mil veinticinco. 
Nueva integración.
Vista la cuenta que antecede se advierte que mediante oficio ***** firmado electrónicamente por Emmanuel González Estrada, Secretario Técnico AA de la Comisión de Adscripción, E ...","Zapopan, Jalisco, a once de abril de dos mil veinticinco. 
Nueva integración.
Vista la cuenta que antecede se advierte que mediante oficio ***** firmado electrónicamente por Emmanuel González Estrada, Secretario Técnico AA de la Comisión de Adscripción, Encargado del Despacho de la Secretaría Ejecutiva de Adscripción del Consejo de la Judicatura Federal, se informó a este órgano jurisdiccional que en sesión ordinaria celebrada el veintiséis de febrero de dos mil veinticinco, el Pleno del Consejo de la Judicatura Federal, acordó la designación del licenciado Manuel Antonio Figueroa Vega como secretario en funciones de magistrado, en este órgano jurisdiccional con efectos a partir del uno de marzo de dos mil veinticinco, mientras subsistan las condiciones, o hasta que el Pleno del Consejo de la Judicatura Federal lo determine.
Por tanto, hágase del conocimiento a las partes del presente asunto, que este Tribunal Colegiado está integrado por el Magistrado Mario Alberto Domínguez Trejo (Ponencia ""A""); Secretario en funciones de Magistrado Manuel Antonio Figueroa Vega (Ponencia ""B""); y, Magistrada Silvia Rocio Pérez Alvarado (Ponencia ""C"").
Returno.
En virtud de lo anterior, retúrnense las presentes actuaciones a la ponencia a cargo del Secretario en funciones de Magistrado Manuel Antonio Figueroa Vega, para que proponga el proyecto de resolución correspondiente.
NOTIFÍQUESE y CÚMPLASE."
https://www.dgej.cjf.gob.mx/siseinternet/reportes/vercaptura.aspx?tipoasunto=10&organismo=1886&expediente=262/2024&tipoprocedimiento=0,30-09-2025,01-10-2025,262/2024,"Zapopan, Jalisco, a treinta de septiembre de dos mil veinticinco. 
Nueva integración.
Visto el ""Acuerdo General del Pleno del Órgano de Administración Judicial por el que se adscriben a las personas electas en el Proceso Electoral Extraordinario a diverso ...","Zapopan, Jalisco, a treinta de septiembre de dos mil veinticinco. 
Nueva integración.
Visto el ""Acuerdo General del Pleno del Órgano de Administración Judicial por el que se adscriben a las personas electas en el Proceso Electoral Extraordinario a diversos cargos del Poder Judicial de la Federación 2024-2025, asimismo, se comisionan, reubican y readscriben, a personas funcionarias de los Órganos Jurisdiccionales, se designan y, en su caso, prorrogan a personas secretarias en funciones de Personas Juzgadoras"", publicado en el Diario Oficial de la Federación el catorce de septiembre del año en curso, por medio del cual el Pleno del referido Órgano de Administración en sesión extraordinaria celebrada el doce del referido mes de septiembre, acordó la adscripción de la Magistrada Nadia Cecilia Lupita Licón González a este Sexto Tribunal Colegiado en Materia Administrativa del Tercer Circuito, con residencia en Zapopan, Jalisco. 
Por tanto, este Tribunal Colegiado está integrado por el Magistrado Mario Alberto Domínguez Trejo (Ponencia ""A""); Magistrada Nadia Cecilia Lupita Licón González (Ponencia ""B""); y, Magistrado Luis Armando Pérez Topete (Ponencia ""C"").
Returno B.
En virtud de lo anterior, retúrnense las presentes actuaciones a la ponencia a cargo de la Magistrada Nadia Cecilia Lupita Licón González, para que proponga el proyecto de resolución correspondiente.
Hágase saber el contenido de este acuerdo a las partes, para los efectos previstos por los artículos 51 y 52 de la Ley de Amparo.
Notifíquese y cúmplase."
https://www.dgej.cjf.gob.mx/siseinternet/reportes/vercaptura.aspx?tipoasunto=1&organismo=5742&expediente=761/2025&tipoprocedimiento=0,03-04-2025,04-04-2025,761/2025,"Vista la demanda de amparo promovida por ..., carácter que acredita con la documental que acompaña y se le reconoce de conformidad con los artículos 6 y 10 de la Ley de Amparo, contra actos de autoridad; fórmese expediente, anótese su ingreso en el libro ...","Vista la demanda de amparo promovida por ..., carácter que acredita con la documental que acompaña y se le reconoce de conformidad con los artículos 6 y 10 de la Ley de Amparo, contra actos de autoridad; fórmese expediente, anótese su ingreso en el libro de control electrónico del Sistema Integral de Seguimiento de Expedientes; y, con apoyo en los artículos 103 y 107 Constitucionales, así como en los numerales 1, 2, 107, 112 y 115 de la Ley de Amparo, SE ADMITE la citada demanda.
Ahora, de conformidad al transitorio identificado como ""SEXTO"" del ACUERDO GENERAL DEL PLENO DEL CONSEJO DE LA JUDICATURA FEDERAL, QUE ABROGA LOS ACUERDOS DE CONTINGENCIA POR COVID-19 Y REFORMA, ADICIONA Y DEROGA DIVERSAS DISPOSICIONES RELATIVAS A LA UTILIZACIÓN DE MEDIOS ELECTRÓNICOS Y SOLUCIONES DIGITALES COMO EJES RECTORES DEL NUEVO ESQUEMA DE TRABAJO EN LAS ÁREAS ADMINISTRATIVAS Y ÓRGANOS JURISDICCIONALES DEL PROPIO CONSEJO; el expediente físico se integrará únicamente con los documentos recibidos por esa vía.
Asimismo, se precisa que las actuaciones judiciales y las promociones que presenten las partes, firmadas electrónicamente, así como la sentencia que en su caso se dicte, obrarán únicamente en el expediente electrónico.
Lo anterior, dado que en este momento el Juzgado se encuentra imposibilitado para integrar de manera simultánea el expediente físico; en razón de que no se cuenta con los insumos necesarios para ello; sin que se inobserve el criterio contenido en la Tesis: PR.A.C.CS. J/21 K (11a.),  registro digital 2030046.
Con fundamento en lo dispuesto por el artículo 115 de la Ley de Amparo, se señalan las CATORCE HORAS CON CUATRO MINUTOS DEL DOCE DE MAYO DE DOS MIL VEINTICINCO, para que tenga verificativo la AUDIENCIA CONSTITUCIONAL. 
La que se procurará practicar mediante el uso de medios tecnológicos y soluciones digitales.
En términos de los numerales 115 y 116 de la Ley de Amparo, PÍDASE A LA AUTORIDAD RESPONSABLE RINDA SU INFORME CON JUSTIFICACIÓN, dentro del término de QUINCE DÍAS; y en el caso de que los actos reclamados sean ciertos, remita a este Juzgado de Distrito copias autorizadas, completas, legibles y ordenadas de todas las constancias que sirvieron de base para emitirlo. Se apercibe de las consecuencias que implica su falta, de conformidad con los diversos 117 y 260 de la Ley de Amparo. 
En relación a lo anterior, se autoriza a las autoridades responsable para que rinda su informe justificado al correo electrónico institucional priscila.barragan.castellanos@correo.cjf.gob.mx con la precisión de que el mismo deberá encontrarse firmado de manera electrónica; por lo que de no contar con dicho requisito, el mismo no será válido.
Asimismo, al momento de rendir su informe antes mencionado, y por esa vía, en caso de remitir documentales vía digital, bajo protesta de decir verdad, manifieste que los documentos digitalizados son copia íntegra e inalterada de los documentos impresos, tal como lo dispone el artículo 3, fracción VI, del ACUERDO GENERAL 12/2020, DEL PLENO DEL CONSEJO DE LA JUDICATURA FEDERAL, QUE REGULA LA INTEGRACIÓN Y TRÁMITE DE EXPEDIENTE ELECTRÓNICO Y EL USO DE VIDEOCONFERENCIAS EN TODOS LOS ASUNTOS COMPETENCIA DE LOS ÓRGANOS JURISDICCIONALES A CARGO DEL PROPIO CONSEJO.
Se le informa a la autoridad responsable que sólo se le notificará por oficio, los proveídos y resoluciones de mayor trascendencia, eso en términos de la jurisprudencia de rubro: ""NOTIFICACIONES A LAS AUTORIDADES EN EL JUICIO DE AMPARO INDIRECTO. FORMA DE REALIZARLAS"".
Luego, notifíquese a la Agente del Ministerio Público Federal adscrita, en términos de los artículos 5, fracción IV, y 26, fracción III, de la Ley de Amparo, por lista; a quien se le hace saber que queda a su disposición una copia de traslado de la demanda de amparo en este órgano jurisdiccional.
Tramitase por cuerda separada el incidente de suspensión como disponen los numerales 125, 128, fracción I, y último párrafo, de la Ley de Amparo.
Apertúrese cuadernillo único de la mencionada incidencia; esto, de conformidad a lo dispuesto en el artículo 264 CAPÍTULO CUARTO intitulado DE LA FORMACIÓN DEL DUPLICADO DE LOS INCIDENTES DE SUSPENSIÓN del ACUERDO GENERAL DEL PLENO DEL CONSEJO DE LA JUDICATURA FEDERAL QUE ESTABLECE LAS DISPOSICIONES EN MATERIA DE ACTIVIDAD ADMINISTRATIVA DE LOS ÓRGANOS JURISDICCIONALES, reformado por el diverso acuerdo mencionado en primer término.
Tampoco ha lugar a tener como tercero interesado a persona alguna, dada la naturaleza de los actos reclamados.
Conforme a lo dispuesto por el ordinal 64 de la Ley de Amparo, hágase saber a las partes, el deber de informar de inmediato a este Juzgado, sobre el conocimiento que tengan de alguna causa de sobreseimiento, y de ser el caso, y estar en posibilidad, acompañar las constancias que la acrediten. Además, se les hace saber lo dispuesto en el artículo 251 de la Ley de Amparo, en el sentido de que la parte que tenga conocimiento de alguna causal de sobreseimiento y no la comunique, se le impondrá multa de conformidad a lo establecido en el citado precepto legal. 
Se habilitan días y horas inhábiles en términos del artículo 21 de la Ley de Amparo, por estimarse pertinente para el adecuado despacho de los asuntos.
Se tiene como autorizado de la parte quejosa en los amplios términos del artículo 12 de la Ley de Amparo, a Juan Carlos de Obeso Orendain y Donaldo Arias Rivera, toda vez que cuentan con cédula profesional inscrita en el Registro Único de Profesionales del Derecho; en tanto que, se le tiene como autorizado en los términos restringidos del citado numeral a la diversa persona que señala, por así señalarlo expresamente. 
Asimismo, ténganse por presentadas las pruebas documentales que acompaña, así como por anunciadas la prueba instrumental de actuaciones y la presuncional en su doble aspecto, en términos del artículo 119 de la Ley de Amparo
Asimismo, respecto a la autorización para la consulta del expediente electrónico relativo al presente asunto y la práctica de sus notificaciones por dicha vía; se acuerda favorable su solicitud, y se comisiona a la o el Secretario del Juzgado habilite la vía electrónica de acuerdo con las condiciones que la misma requiera, con fundamento en el artículo 3 de la Ley de la materia; en tanto que, comisiónese al Actuario adscrito para que practique las notificaciones de carácter personal, en la citada vía, dado que la parte quejosa lo solicitó expresamente. 
En cuanto a su solicitud para el uso de medios electrónicos y digitales en el presente asunto, dígasele que no existe inconveniente para que las personas autorizadas se impongan del contenido de los acuerdos dictados en el expediente, mediante el uso de aparatos electrónicos como lo son cámaras o lectores ópticos, dejando constancia en autos de la reproducción realizada. En el entendido, que el uso que den a las copias obtenidas con cámaras, escáner, grabadoras o lectores ópticos, será bajo su más estricta responsabilidad.
Se exhorta al resto de las partes, para que si les es posible, actúen de manera electrónica, desde el Portal de Servicios en Línea del Poder Judicial de la Federación.
Dígasele a las partes que los datos personales y sensibles que se alleguen en el presente asunto, quedan sujetos a lo contemplado en los artículo 1, 3, fracciones IX, X, y XVII, 5, 18, 22, fracciones IV, y V, 25, 26, 27 y 31 de la Ley General de Protección de Datos Personales en Posesión de Sujetos Obligados.
En cumplimiento de lo ordenado en los artículos 1, 9, 16, 113, fracción I y 117 de la Ley Federal de Transparencia y Acceso a la Información Pública; así como el numeral 73, fracción II, de la Ley General de Transparencia y Acceso a la Información Pública, las resoluciones así como la sentencia que se emitan en este juicio, estarán a disposición del público para su consulta cuando así lo soliciten.
Finalmente, de conformidad con lo estatuido en el Título Tercero de la Ley General de Protección de Datos Personales en Posesión de Sujetos Obligados, hágase saber a las partes la facultad que les asiste para oponerse a la publicación de sus nombres y datos personales, lo que deberán manifestar expresamente siguiendo los lineamientos ahí señalados; en el entendido que de no realizar manifestación alguna, las resoluciones que se emitan se publicarán sin supresión de datos."
